VideoID,captions,cluster,cluster_letra
Y9lGSRcIQ68,unchaltt electrical computer engineering presentation screen slide white light shining dark presentation screen whiteboard presentation screen whiteboard presentation screen presentation presentation screen presentation presentation screen whiteboard presentation screen presentation presentation screen presentation presentation screen presentation man standing front screen presentation project slide presentation project slide man giving presentation project presentation project slide presentation project slide presentation project slide presentation project slide man standing front blackboard man standing front blackboard man giving presentation project man standing front blackboard man standing front blackboard man standing front blackboard man standing front blackboard man standing front blackboard man standing front blackboard man standing front blackboard man standing front blackboard man standing front blackboard man standing front blackboard man standing front blackboard man standing front blackboard man standing front blackboard man standing front blackboard man standing front blackboard man standing front blackboard man standing front blackboard man standing front projector man standing front blackboard man giving lecture whiteboard man giving presentation project man giving lecture blackboard whiteboard blackboard man giving presentation project man giving presentation project man standing front blackboard screen white screen green screen man giving presentation project screen white screen black screen screen white screen black screen screen message man standing front blackboard person standing front blackboard man standing front blackboard man standing front blackboard presentation project projector man standing front blackboard man giving presentation project blackboard whiteboard man standing front blackboard man standing front blackboard man standing front blackboard person standing front blackboard screen white screen black screen man standing front blackboard man giving presentation project person standing front projector man standing front blackboard man standing front blackboard man standing front blackboard man standing front blackboard man standing front projection screen presentation screen whiteboard presentation screen whiteboard man giving presentation project presentation screen whiteboard person standing front projection screen presentation screen whiteboard presentation screen whiteboard presentation screen whiteboard man giving presentation project presentation screen whiteboard man standing front blackboard man standing front blackboard man giving presentation project person standing front blackboard person standing front blackboard person standing front blackboard person standing front projector man giving presentation project man standing front blackboard man giving presentation project man giving lecture blackboard man standing front blackboard man giving presentation project man standing front blackboard man standing front blackboard presentation screen slide presentation project whiteboard person standing front screen man giving presentation project man giving presentation project presentation screen whiteboard presentation screen whiteboard man giving presentation project man giving presentation project man giving presentation project man giving presentation project man giving presentation project man giving presentation project man standing front projection screen man giving presentation project embedded system lecture james conrad topic introduction microcontrolers man giving presentation project man giving presentation project presentation project whiteboard man giving presentation project man giving presentation project person standing front screen man giving presentation project man giving presentation project man standing front screen man giving presentation screen man standing front screen man giving presentation project man giving presentation project man giving presentation project man giving presentation project man giving presentation project man giving presentation project man giving presentation project man standing front projection screen man giving presentation project man giving presentation project man giving presentation project man standing front screen man giving presentation project man giving presentation project man giving presentation project black background white red flower man standing front blackboard person standing front projection screen man standing front blackboard man standing front projection screen man sitting table front blackboard man standing front projection screen man standing front projection screen black background white text read information http webpage ed man standing front projection screen man giving presentation project person standing front projection screen man giving presentation project man giving presentation project man giving presentation project person standing front blackboard man giving presentation project presentation project projector man standing front projection screen man standing front projection projection man giving presentation screen man giving presentation screen man standing front projection projection man standing front projection projection man standing front blackboard man giving lecture project man standing front blackboard man giving presentation project man standing front projection screen man giving lecture project man giving lecture project man standing front projection screen man standing front projection screen man standing front projection screen man standing front projection projection man standing front blackboard man giving lecture project man standing front blackboard man standing front blackboard man standing front projection projection man standing front projection projection man standing front projection projection man standing front projection screen man giving lecture project man standing front blackboard man giving presentation project presentation screen diagram man giving presentation project man giving lecture project man standing front blackboard man standing front blackboard whiteboard whiteboard presentation screen slide whiteboard whiteboard presentation screen whiteboard man giving presentation project presentation screen slide whiteboard whiteboard presentation screen whiteboard presentation screen whiteboard presentation screen whiteboard presentation screen whiteboard presentation screen whiteboard presentation screen whiteboard presentation screen whiteboard presentation project projector presentation project projector presentation project projector man giving presentation project presentation project projector man giving presentation project presentation project projector presentation project slide presentation project slide presentation project slide presentation project slide presentation project screen presentation project slide presentation project slide man giving presentation project presentation project slide presentation project slide presentation screen whiteboard presentation screen whiteboard presentation screen whiteboard presentation screen whiteboard man standing front blackboard man standing front blackboard presentation screen whiteboard,3,D
bf9BYmYPqkE,man brown shirt standing front whiteboard man standing front screen man standing front screen man brown shirt standing front whiteboard man standing front whiteboard man pointing whiteboard,3,D
eGdxXGJglLQ,television screen tv screen showing television screen screen shot computer screen word copyright 2013 man sitting table laptop person writing whiteboard pencil person writing whiteboard marker man sitting chair laptop man sitting desk laptop man blue shirt sitting person writing whiteboard pen whiteboard drawing person writing whiteboard marker person writing whiteboard marker man blue shirt glass sitting chair person writing whiteboard marker person writing whiteboard marker person writing whiteboard marker man sitting chair laptop man blue shirt sitting man sitting desk laptop person writing whiteboard marker man sitting desk laptop man blue shirt sitting chair man blue shirt sitting picture person room person writing whiteboard man blue shirt sitting chair man blue shirt sitting chair picture person room picture person room person writing whiteboard person writing whiteboard green marker man holding computer board circuit man holding small electronic device person writing whiteboard green marker man sitting table laptop man holding computer board circuit man holding computer board circuit person holding computer board person working computer person working computer man glass tie person holding small device circuit person holding small device hand person holding small computer computer processor red light top person writing whiteboard marker person writing whiteboard pen person writing whiteboard red pen person writing whiteboard red pen person writing whiteboard red pen person writing whiteboard red pen person writing whiteboard red marker man sitting table laptop person writing whiteboard red marker person using small device make circuit man sitting table laptop man sitting desk laptop person writing whiteboard red pen person holding red pen writing white board person writing whiteboard red marker man sitting desk pen hand person writing whiteboard red pen person writing whiteboard person holding piece paper writing man sitting desk laptop person writing whiteboard pencil man holding computer board circuit person writing whiteboard red marker person writing whiteboard red marker person writing whiteboard red marker person using red pen fix circuit person writing whiteboard red marker person writing whiteboard red marker person writing whiteboard red marker person writing whiteboard marker person writing whiteboard man sitting table red object person writing whiteboard red marker person writing whiteboard red marker person writing whiteboard red pen man working computer person writing whiteboard red marker person writing whiteboard marker person writing whiteboard red marker person writing whiteboard red marker person writing whiteboard man sitting table laptop man working computer person writing piece paper man working computer whiteboard hand pointing whiteboard red marker man writing piece paper man sitting desk laptop man sitting desk laptop man sitting chair laptop person writing whiteboard red marker man sitting desk laptop person writing whiteboard marker man sitting table laptop person writing whiteboard man sitting table laptop thumb thumb thumb thumb thumb thumb thumb thumb thumb thumb thumb thumb thumb thumb thumb thumb thumb thumb thumb thumb person writing whiteboard thumb thumb thumb thumb thumb thumb thumb thumb thumb thumb thumb thumb thumb thumb thumb thumb thumb thumb thumb thumb person writing whiteboard green marker man sitting desk pen hand person writing whiteboard green marker person writing whiteboard green marker thumb thumb thumb thumb thumb thumb thumb thumb thumb thumb thumb thumb thumb thumb thumb thumb thumb thumb thumb thumb person writing whiteboard person writing whiteboard red pen person writing whiteboard red marker person writing whiteboard pen person writing whiteboard red marker man sitting table laptop screen shot text read copyright 2013 person writing whiteboard green marker man sitting table pen hand man drawing board marker thumb thumb thumb thumb thumb thumb thumb thumb thumb thumb thumb thumb thumb thumb thumb thumb thumb thumb thumb thumb man sitting table pen hand person writing whiteboard red pen man sitting chair pen man sitting table laptop person writing whiteboard red marker person writing whiteboard man blue shirt glass sitting chair person writing whiteboard pen person drawing piece paper person writing whiteboard marker person writing whiteboard marker person drawing piece paper person drawing whiteboard man sitting desk pen paper person writing piece paper man sitting table book person writing whiteboard person drawing sketch piece paper person drawing sketch whiteboard person drawing web page piece paper person drawing diagram piece paper man sitting table laptop man sitting table laptop person writing whiteboard person drawing diagram piece paper man sitting desk laptop person drawing diagram whiteboard man sitting table laptop person drawing sketch piece paper man sitting desk pen paper man sitting desk laptop man sitting desk laptop man sitting table laptop person writing whiteboard green marker man sitting table laptop man sitting desk book man sitting desk pen paper person writing whiteboard red pen person writing whiteboard pen person writing whiteboard marker person writing whiteboard green marker person writing whiteboard marker man sitting table laptop man sitting table laptop man sitting desk laptop man sitting desk laptop person writing whiteboard green marker man standing front computer man standing front computer person writing whiteboard red pen man playing old video game man standing desk computer person using credit machine person using calculaer pay money cash machine red light man standing front computer machine sitting top table man standing desk computer person writing whiteboard red pen video game console played man video game console played man man standing front computer man standing front computer person using knife cut piece wood television set monitor monitor person working machine man suit looking computer screen man standing front door man white shirt standing front computer computer green screen white keyboard person writing whiteboard red pen man standing front television screen man sitting desk two monitor man sitting desk computer person using sewing machine television screen picture man suit man sitting desk laptop man holding nintendo game console hand writing whiteboard man sitting desk pen hand man sitting table laptop person writing whiteboard pen person writing whiteboard pen person writing whiteboard pen person writing whiteboard man sitting desk pen hand person writing whiteboard green marker person writing whiteboard pen person writing whiteboard pen person writing whiteboard pen person writing whiteboard red pen person writing piece paper person writing whiteboard person writing whiteboard pen person writing whiteboard person writing whiteboard pen person writing whiteboard pen person writing whiteboard man sitting desk pen paper person writing whiteboard person writing whiteboard whiteboard diagram man sitting desk laptop person writing whiteboard person writing whiteboard person writing whiteboard black white sign word care educational technology person writing whiteboard person writing whiteboard person writing piece paper person writing whiteboard pen person writing whiteboard pen person writing piece paper person writing whiteboard whiteboard diagram person writing whiteboard person writing whiteboard pen person writing whiteboard person putting piece computer person writing whiteboard man sitting desk computer person putting something television man sitting desk laptop person working computer person holding small device hand man sitting desk laptop man writing whiteboard person holding small device hand person writing whiteboard person drawing diagram whiteboard person holding small piece electronics person writing whiteboard person writing whiteboard marker person writing whiteboard marker man sitting desk laptop man writing whiteboard person writing whiteboard marker man sitting desk laptop person writing whiteboard marker man writing whiteboard pen man sitting table glass person writing whiteboard man sitting table laptop person writing whiteboard person writing whiteboard green marker person writing whiteboard marker person drawing circuit whiteboard person writing whiteboard whiteboard diagram man sitting chair laptop person writing whiteboard title title film micros micros person writing whiteboard marker person writing whiteboard marker whiteboard diagram person writing whiteboard marker person writing whiteboard marker person writing whiteboard marker person writing whiteboard marker person writing whiteboard red pen black screen word pro aip person writing whiteboard red marker man blue shirt sitting chair man sitting chair pen man sitting chair cigarette man sitting desk laptop man sitting desk laptop person writing whiteboard red marker man sitting front laptop computer person writing whiteboard pen man sitting chair microphone person writing whiteboard marker person writing whiteboard person writing whiteboard pen person writing whiteboard marker hand writing whiteboard marker man sitting desk pen hand person writing whiteboard pen person writing whiteboard pen person writing whiteboard person writing whiteboard pen person writing whiteboard green marker person writing whiteboard green marker person writing whiteboard pen man sitting front curtain person writing whiteboard pen person writing whiteboard pen man sitting front laptop computer man sitting chair laptop person writing whiteboard pen person writing whiteboard pen person writing whiteboard pen man sitting table laptop man sitting desk laptop person writing whiteboard pen person writing whiteboard person writing whiteboard marker person writing whiteboard green marker person writing whiteboard marker man sitting desk laptop man sitting chair cigarette person writing whiteboard green marker person writing whiteboard marker person writing whiteboard marker person writing whiteboard marker person writing whiteboard marker person writing whiteboard green marker man sitting chair cigarette person writing whiteboard green marker person writing whiteboard pen person writing whiteboard marker person writing whiteboard marker man sitting chair laptop person writing whiteboard pen person writing whiteboard pen,3,D
gxiUxd9Zkbg,man standing front podium man standing podium green screen cover book future child man standing front screen man standing podium laptop man standing front blackboard man standing podium blackboard man standing front screen blackboard word data whiteboard word data man standing podium front screen man standing front blackboard man standing podium green screen white background red black text read best way get job man standing podium blackboard man standing front blackboard man standing front blackboard man standing front blackboard man tie pointing blackboard man standing front blackboard man standing front blackboard man standing front blackboard man giving presentation blackboard man standing front blackboard man standing podium blackboard man standing podium green screen man tie standing front blackboard black screen word data man standing podium microphone man standing front blackboard man tie shirt standing podium man white shirt tie giving presentation man standing podium laptop man standing podium laptop man standing podium laptop man tie giving speech man tie giving presentation man standing podium front screen poster spanish language course universidad virtual software white sheet word man tie white sheet word oviddo ododo black screen word data man standing podium microphone black screen word data man standing podium tv screen black screen word data man standing podium microphone white paper word data en de matica man standing podium green screen man standing podium tv screen man standing podium microphone man standing podium blackboard man standing podium microphone data data data data data data data data data data data data data data data data data data data data man standing podium laptop man tie shirt standing podium man standing podium green screen black screen word data man standing podium front screen man standing podium laptop man standing podium laptop man standing podium green screen man standing podium tv screen man standing podium screen man standing podium front screen black screen word data man standing podium green screen man standing podium microphone black screen word data man standing podium front screen man standing podium microphone man standing podium front screen data data data data data data data data data data data data data data data data data data data data data visual data visual data visual data visual data visual data visual data visual data visual data visual data visual man standing podium tv screen man tie data data data data data data data data data data data data data data data data data data data data man tie standing podium man standing podium front screen man standing podium green screen man standing podium green screen man tie standing podium man standing podium laptop man tie standing podium man tie man tie standing podium man tie shirt standing podium man tie standing podium man standing front tv screen man standing podium green screen man tie shirt standing podium man standing podium laptop man standing podium blackboard man tie standing podium man tie shirt standing podium man tie shirt standing podium man tie shirt standing podium man standing podium laptop man standing podium laptop man white shirt tie standing podium man tie standing podium man standing podium hand man tie giving presentation man standing podium blackboard man standing podium laptop black screen word data man standing podium green screen man standing podium green screen man standing podium laptop man standing podium microphone man standing podium green screen man standing podium tv screen man white shirt tie standing podium man standing podium blackboard man standing podium microphone man standing podium green screen man white shirt tie standing podium man tie man standing podium microphone man standing podium laptop black screen yellow text read data data data data data data data data data data data data data data data data data data data data data man standing front podium man standing podium front screen man standing podium green screen man standing podium green screen man standing podium green screen black screen word data black screen word data black screen word diata man standing podium microphone man standing podium blackboard man standing podium green screen man standing front tv screen,3,D
tELhGLWkuZY,man white shirt sitting desk man white shirt standing front whiteboard man white shirt standing front glass window man white shirt talking someone man white shirt standing front whiteboard man white shirt standing front whiteboard man white shirt standing front whiteboard man white shirt standing front whiteboard man white shirt talking someone man white shirt standing front whiteboard man white shirt standing front whiteboard man white shirt talking man white shirt standing front wall man white shirt talking man white shirt talking man white shirt talking someone man white shirt talking someone man white shirt standing front whiteboard man white shirt holding piece food man white shirt tie speaking man white shirt standing front whiteboard person using laptop table man white shirt talking someone man white shirt standing front whiteboard man blue jacket standing front gray background man white shirt talking someone man white shirt standing front whiteboard man white shirt standing front whiteboard man white shirt standing front whiteboard man white shirt talking someone,3,D
