VideoID,captions,cluster,cluster_letra
14XvT5iEfns,large screen word university sheffield logo new logo sign say university sheffield man giving presentation project man giving presentation whiteboard man giving lecture project man giving lecture whiteboard whiteboard blackboard man giving presentation project man giving lecture whiteboard whiteboard blackboard man giving lecture whiteboard man standing front whiteboard man standing front projection screen man standing front whiteboard large screen word university sheffield man standing front projection screen man standing front whiteboard man standing front whiteboard man standing front projection screen man giving presentation whiteboard man giving presentation project man standing front projection screen large screen word university sheffield man standing front projection screen man standing front projection screen man giving presentation project man giving presentation project man giving presentation project man standing front projection screen whiteboard whiteboard man standing front projection screen man standing front projection screen man standing front whiteboard man standing front whiteboard sign say university sheffield man standing front whiteboard man giving presentation whiteboard man standing front whiteboard man standing front whiteboard man standing front whiteboard man giving presentation whiteboard man standing front projection screen man standing front whiteboard man giving presentation project sign say university sheffield man standing front whiteboard man giving presentation project man giving presentation project man pointing screen whiteboard man standing front projector screen man pointing screen picture man standing front large screen man standing front large screen man pointing screen video man standing front projector screen large screen word university sheffield man standing front whiteboard man standing front large screen man standing front projector man standing front large screen man giving presentation project man standing front projector man giving presentation project man standing front large screen man giving presentation project sign say university sheffield man standing front projection screen man standing front projector man standing front whiteboard man standing front projection screen man standing front projection screen man standing front projection screen man standing front projection screen man standing front whiteboard whiteboard diagram man standing front whiteboard man giving presentation whiteboard large screen word university sheffield man standing front projection screen man giving presentation whiteboard man giving presentation whiteboard man giving lecture whiteboard man giving presentation whiteboard man giving presentation project man giving lecture whiteboard man standing front whiteboard man standing front large screen man standing front whiteboard man giving lecture whiteboard man giving lecture whiteboard man giving lecture whiteboard man standing front projection screen man standing front whiteboard man standing front whiteboard man giving lecture whiteboard man standing front projection screen man standing front projection screen man giving presentation whiteboard man standing front projection screen man standing front projection screen man standing front projection screen man standing front projection screen man standing front large screen man standing front projection screen man standing front projection screen man standing front projection screen man giving presentation project man standing front projection screen man standing front projection screen man standing front projection screen man standing front projection screen man standing front large screen sign say university sheffield man standing front projection screen man giving lecture whiteboard man standing front whiteboard man pointing whiteboard man standing front projection screen man standing front whiteboard man giving lecture screen man standing front whiteboard man standing front large screen man standing front whiteboard man standing front whiteboard man giving presentation project man giving presentation project man standing front whiteboard man standing front whiteboard man giving presentation project man giving presentation project man giving presentation project man standing front projection screen man standing front whiteboard man standing front whiteboard man giving presentation project man standing front projection screen man standing front projector screen man standing front projection screen man standing front whiteboard man standing front whiteboard man standing front projection screen man standing front projection screen man standing front projection screen man standing front projection screen man standing front projection screen man standing front projection screen man pointing projector screen man standing front projection screen man standing front projection screen man standing front projection screen man standing front projection screen man standing front projection screen man giving presentation project man standing front projection screen man standing front screen man standing front projection screen man standing front projection screen man standing front projection screen man standing front projection screen man standing front projection screen man standing front projection screen man standing front projection screen man standing front projection screen man standing front projection screen man standing front projection screen man standing front projection screen man standing front projection screen man standing front screen man standing front screen man standing front projection screen man standing front projection screen man standing front projection screen man giving presentation project man giving presentation project man standing front projection screen large screen word university sheffield man standing front projection screen man standing front large screen man standing front large screen man standing front large screen man giving presentation project man standing front project board man standing front whiteboard man giving presentation project man giving presentation project man standing front whiteboard man standing front projection screen man standing front projection screen man standing front projection screen sign say university sheffield man standing front projection screen man standing front projection screen man standing front projection screen man standing front projection screen man standing front projection screen large screen word university sheffield man pointing whiteboard man pointing whiteboard man standing front whiteboard man standing front projector screen man standing front projector man giving presentation project man pointing whiteboard man standing front projection screen man standing front projector screen man standing front projector man giving presentation whiteboard man giving presentation whiteboard large screen word university sheffield man standing front projector screen man giving presentation project man standing front large screen man standing front large screen man standing front projection screen man standing front projection screen man giving presentation project man standing front whiteboard man standing front projection screen man giving presentation project large screen word university sheffield man giving presentation project man standing front whiteboard man standing front projection screen man giving presentation project man pointing whiteboard man standing front projection screen man standing front large screen man standing front projection screen man giving presentation project sign say university sheffield man standing front projection screen man giving presentation project man giving presentation project man giving presentation project man giving presentation project man giving presentation project man standing front projection screen man standing front whiteboard man standing front whiteboard man standing front projection screen man standing front whiteboard man giving presentation whiteboard man standing front whiteboard man giving presentation project man standing front whiteboard large screen sign say u sening being man standing front whiteboard man standing front whiteboard man standing front whiteboard man giving lecture whiteboard man standing front whiteboard man giving lecture whiteboard,3,D
6FliHIDP5fo,man writing whiteboard marker man writing whiteboard marker,3,D
8h-B0v6qa0A,black background white red flower man green shirt standing front white wall man green shirt standing front white wall man standing front whiteboard man green shirt standing front white wall man green shirt man green shirt standing front white wall man standing front whiteboard man writing whiteboard man writing whiteboard man green shirt standing front whiteboard man writing whiteboard man standing front whiteboard man writing whiteboard man writing whiteboard man standing front whiteboard man standing front whiteboard man standing front whiteboard man standing front whiteboard man standing front whiteboard man standing front whiteboard man standing front whiteboard man pointing whiteboard man standing front whiteboard man standing front whiteboard man standing front whiteboard man standing front whiteboard man standing front whiteboard man pointing whiteboard man standing front whiteboard man standing front whiteboard man green shirt standing front white wall man standing front whiteboard man standing front whiteboard man standing front whiteboard man standing front whiteboard man standing front whiteboard man standing front whiteboard man writing whiteboard man standing front whiteboard man standing front whiteboard man standing front whiteboard man green shirt standing front white wall man standing front whiteboard man standing front whiteboard man standing front whiteboard man standing front whiteboard man standing front whiteboard man green shirt glass man pointing whiteboard man standing front whiteboard man standing front whiteboard man standing front whiteboard man standing front whiteboard man standing front whiteboard man standing front whiteboard man standing front whiteboard man standing front whiteboard man standing front whiteboard man standing front whiteboard man standing front whiteboard man green shirt standing front white wall man standing front whiteboard man green shirt standing front white wall man green shirt standing front white wall man green shirt standing front white wall,3,D
ECzzX0PfIeE,man white shirt talking woman screenshot doctor doctor white coat screen shot man white shirt man white shirt web page screenshot doctor man lab screenshot doctor doctor white coat screenshot doctor doctor white coat screenshot doctor doctor white coat screenshot doctor man lab screenshot doctor doctor white coat screenshot doctor doctor white coat screenshot doctor man lab screenshot man lab blackboard man white shirt web page screenshot doctor giving thumb screenshot doctor doctor white coat screenshot doctor doctor white coat screenshot doctor doctor white coat man holding computer screenshot doctor doctor white coat man holding computer man holding computer front screen man pointing screen diagram man pointing screen diagram screenshot doctor doctor white coat man pointing screen diagram man holding circuit board circuit man white shirt web page man holding circuit board man holding circuit board man holding computer front screen man holding circuit board circuit man holding circuit board circuit man holding circuit board man white shirt web page man holding computer front screen man pointing screen diagram man holding circuit board man holding circuit board man holding circuit board circuit computer screen showing diagram circuit man holding circuit board computer screen man holding circuit man holding circuit board man holding circuit board man holding circuit board man holding circuit board man white shirt web page computer screen man holding circuit man pointing screen diagram man pointing screen diagram man holding computer front screen man lab shown computer screen man standing front whiteboard man pointing screen diagram man lab shown computer screen man standing front whiteboard man white shirt web page man giving presentation whiteboard man standing front whiteboard man holding computer board man holding computer board computer screen man lab coat computer screen man lab computer screen man lab screen shot computer screen man lab computer screen man lab man white shirt talking camera computer screen man lab computer screen man lab computer screen showing diagram circuit computer screen man lab man standing front computer screen man white coat standing next computer computer screen showing picture man lab computer screen man lab man standing front whiteboard man pointing screen diagram man white shirt web page man standing front computer man standing front screen man standing front computer man standing front computer computer screen showing diagram circuit man white coat standing next computer man standing front screen man white shirt standing next computer man standing front computer computer screen showing diagram device man standing front computer man pointing screen whiteboard man standing front computer man white shirt web page man standing front computer man standing front screen man standing front screen man standing front computer man standing front screen computer screen man lab man sitting front computer computer screen showing diagram circuit computer screen showing diagram circuit screen shot man white shirt computer screen showing man lab man standing front screen man pointing screen diagram man standing front computer screen man talking cell phone man standing front whiteboard man talking cell phone man standing front whiteboard man standing front whiteboard man white shirt web page man standing front whiteboard man standing front whiteboard man standing front whiteboard man white shirt web page man standing front whiteboard presentation topic lecture lecture lecture lecture lecture man standing front whiteboard video screen showing man white shirt man standing front whiteboard man standing front whiteboard man standing front whiteboard man standing front whiteboard man standing front whiteboard man standing front whiteboard man standing front whiteboard man standing front whiteboard man pointing whiteboard man standing front whiteboard man standing front whiteboard man standing front whiteboard man standing front whiteboard man standing front whiteboard man lab whiteboard man white shirt web page man standing front whiteboard man standing front whiteboard man standing front whiteboard man standing front whiteboard man white lab coat shown screen screen shot man lab presentation web man lab presentation web man white shirt presentation web man white coat man white shirt web page presentation web man white shirt presentation web man lab man white shirt standing front screen screen shot man white shirt tie screen shot man lab screen shot man white shirt white shirt word te man white shirt standing front screen word tecito presentation web man lab screen shot man white shirt presentation web man lab presentation web man white shirt man white shirt giving presentation presentation web man white shirt screen shot man white shirt presentation web man white shirt presentation web man white shirt web page man lab man giving presentation screen screen shot man white shirt screen shot man white shirt white shirt word te man white shirt web page screen shot web page man white shirt screen shot man white shirt screen shot web page man white shirt screen shot man white shirt video screen showing video man white shirt screen shot web page man lab screenshot man white shirt screen shot man white shirt red shirt man white shirt talking camera screen shot man white shirt red shirt screen shot web page man white shirt screenshot man white shirt red shirt screenshot man lab screen shot web page man lab coat screen shot web page man white shirt screen shot web page man white shirt man speaking front screen man talking computer screen computer screen man white shirt screen shot man white shirt man speaking microphone screen shot man white shirt man white shirt screen screen shot man lab man white shirt standing front screen screen shot web page man white shirt screen shot man white shirt video screen showing video man white shirt screen shot man white shirt screen shot man white shirt screen shot man white lab coat screen shot man white shirt red shirt screen shot man white shirt web page man white shirt man white shirt web page web page man lab coat video screen showing video man white shirt man sitting front computer man standing front screen man talking video screen video screen showing video man white shirt screen shot man white shirt red shirt video screen showing video man lab man sitting front computer man sitting front computer man white shirt web page video screen showing video man white shirt man sitting front computer man sitting front computer man standing front screen man standing front screen man white shirt sitting table man sitting front computer video screen showing man lab coat man standing front screen screen shot man white lab coat screen shot computer screen showing video man white shirt web page man looking computer screen video screen showing video man lab man white shirt standing front screen man white shirt shown screen man white shirt shown screen man white shirt shown screen man white shirt holding green circuit man white lab coat shown screen man white shirt holding green circuit man white shirt shown screen man white shirt standing front computer screen man white shirt web page man white shirt shown screen circuit man white shirt standing front computer screen man white shirt standing front computer screen man white lab coat shown screen man shown screen computer computer screen showing circuit circuit man white shirt shown screen circuit man white shirt standing next computer man white shirt shown screen screen shot computer man white shirt video screen showing presentation web video man lab man white shirt web page video screen showing presentation web video screen showing video doctor video screen showing video man lab video screen showing video man white shirt video screen showing video man lab video screen showing video man white shirt man white shirt web page video screen showing video man white shirt video screen showing video doctor screen shot web page man white coat screen shot web page man white shirt video screen showing video man lab video screen showing video man white shirt video screen showing video man lab video man white lab coat video man lab coat video screen showing video man lab computer screen man lab video screen showing video man white shirt man white shirt web page video screen showing video man lab computer screen man lab computer screen man white shirt computer screen man lab man sitting front computer web page man lab video screen showing video man lab web page man lab computer screen man lab video screen showing video man white shirt web page man lab man white shirt web page computer screen man white shirt computer screen man lab computer screen man lab video screen showing video man lab web page man white shirt computer screen man lab computer screen man lab coat computer screen man white shirt man white shirt web page web page man white shirt computer screen man lab web page man lab coat computer screen man phone screen shot man white lab coat computer screen man white shirt computer screen man lab computer screen man white shirt computer screen man white shirt man sitting front computer man white shirt web page computer screen video computer screen man lab computer screen man lab computer screen man lab website man white shirt computer screen man white shirt website man lab coat man standing front screen man standing front screen man white shirt standing front screen man white shirt standing front screen man white shirt web page man sitting table laptop man sitting table laptop man sitting front computer screen man sitting table laptop man sitting table laptop man sitting table laptop man white shirt sitting front screen man sitting desk laptop screenshote video man lab website man lab coat man standing front screen man white shirt web page web page man white shirt man standing front screen man sitting table laptop man white shirt standing front screen man standing front screen man sitting table laptop website man white shirt man white shirt web page man sitting table laptop man white shirt web page man sitting front computer man white lab coat shown screen web page man white shirt web page man lab man sitting front computer screen web page man white shirt screen shot man white shirt video screen showing man white shirt screen shot man white shirt man white shirt web page screen shot man white lab coat man white shirt web page screen shot man white shirt screen shot man white shirt screen shot man white shirt man white shirt web page man white shirt web page man speaking front screen man white shirt pointing camera man white shirt web page man white shirt web page man white lab coat shown screen man white shirt web page man white shirt web page man white shirt web page screen shot man white shirt screen shot man white shirt man white lab coat pointing camera man white shirt web page screen shot man white shirt man white shirt web page man white lab coat shown screen man white shirt giving thumb man white lab coat talking camera man white lab coat shown screen screen shot website doctor man white shirt web page man white shirt web page man white shirt giving thumb screenshot man lab blackboard screen shot web page man lab screenshot man lab blackboard screenshot doctor doctor white coat screenshot doctor doctor white coat screenshot doctor doctor white coat screenshot doctor man lab man white shirt web page screenshot doctor doctor white coat screenshot doctor doctor white coat screenshot doctor doctor white coat screenshot doctor doctor white coat screenshot doctor doctor white coat screenshot doctor doctor white coat screenshot doctor doctor white coat screenshot doctor doctor white coat screenshot doctor doctor white coat screenshot doctor man lab screenshot doctor man lab man white shirt web page screenshot doctor doctor white coat screenshot doctor man lab screenshot doctor doctor white coat screenshot doctor man lab screenshot doctor doctor white coat screenshot doctor doctor classroom screenshot doctor doctor white coat screenshot doctor man lab screenshot doctor doctor white coat screenshot doctor doctor white coat screenshot doctor doctor white coat,3,D
SBh6dJMM6AI,man standing front white wall man standing front white screen man standing front projection screen man standing front whiteboard man giving presentation screen man standing front whiteboard man standing front whiteboard man standing front whiteboard man standing front projection screen man pointing whiteboard man giving presentation project man giving presentation project man standing front whiteboard man standing front screen man giving presentation project man standing front screen man pointing screen whiteboard woman pointing screen whiteboard man standing front whiteboard man standing front whiteboard man standing front projection screen man standing front white wall man standing front whiteboard man standing front whiteboard man standing front white wall man standing front whiteboard man standing front screen microtroler microtroler comit man standing front whiteboard man pointing whiteboard man standing front white wall man writing whiteboard man pointing whiteboard microspicen microspicen microspicen microspicen microspicen man standing front whiteboard man standing front whiteboard man standing front white screen man giving presentation project man standing front white wall microtroler microtroler small compound microtroler man standing front projection screen man standing front whiteboard,3,D
